{
  "schemaVersion": 1,
  "trackId": "final-score-lament",
  "title": "Final Score Lament",
  "status": "legacy-active",
  "audioMode": "loop",
  "webAudioPath": "./assets/audio/final_score_lament.mp3",
  "audioHash": "1cb086bfd609ae010d162062673a9fdc402766c11fe5146941f5f4de66314d10",
  "loopDuration": 30,
  "rhythm": {
    "tempoHint": null,
    "bpmOverride": null,
    "beatOffsetOverride": null
  },
  "suggestedSections": [],
  "provenance": {
    "sourceType": "legacy-unknown",
    "provider": null,
    "commercialUseStatus": "review-required",
    "privateEvidenceRef": null
  }
}
