{
  "schemaVersion": 1,
  "trackId": "silver-ember-28560e4a5d",
  "title": "Silver Ember 28560E4A5D",
  "status": "active",
  "audioMode": "single",
  "webAudioPath": "./assets/audio/selectas/silver-ember-28560e4a5d.mp3",
  "audioHash": "28560e4a5dbf2d6a733f9fac74b0fc67e843eeb0241ca458377688c565153be8",
  "rhythm": {
    "tempoHint": 103.359375,
    "bpmOverride": null,
    "beatOffsetOverride": null
  },
  "suggestedSections": [
    {
      "id": "read",
      "name": "LECTURA",
      "startTime": 0,
      "endTime": 19.137838
    },
    {
      "id": "drive",
      "name": "IMPULSO",
      "startTime": 19.137838,
      "endTime": 38.275677
    },
    {
      "id": "climax",
      "name": "CLIMAX",
      "startTime": 38.275677,
      "endTime": 57.413515
    }
  ],
  "provenance": {
    "sourceType": "ai-generated",
    "provider": "suno",
    "commercialUseStatus": "evidence-required",
    "privateEvidenceRef": null
  },
  "durationSeconds": 57.413515
}
