{
  "schemaVersion": 1,
  "trackId": "whispering-glades",
  "title": "Whispering Glades",
  "status": "legacy-active",
  "audioMode": "loop",
  "webAudioPath": "./assets/audio/whispering_glades.mp3",
  "audioHash": "0f81707ea76328582cfb2184e6bb602226c83cd19f4569de645d66eb883677af",
  "loopDuration": 30,
  "rhythm": {
    "tempoHint": null,
    "bpmOverride": null,
    "beatOffsetOverride": null
  },
  "suggestedSections": [],
  "provenance": {
    "sourceType": "legacy-unknown",
    "provider": null,
    "commercialUseStatus": "review-required",
    "privateEvidenceRef": null
  }
}
