{
  "schemaVersion": 1,
  "trackId": "glass-and-asphalt",
  "title": "Glass And Asphalt",
  "status": "legacy-active",
  "audioMode": "loop",
  "webAudioPath": "./assets/audio/glass_and_asphalt.mp3",
  "audioHash": "12bb801a693d7a5526e60020132895b824ce99079d349479f811bab9371974b8",
  "loopDuration": 30,
  "rhythm": {
    "tempoHint": null,
    "bpmOverride": null,
    "beatOffsetOverride": null
  },
  "suggestedSections": [],
  "provenance": {
    "sourceType": "legacy-unknown",
    "provider": null,
    "commercialUseStatus": "review-required",
    "privateEvidenceRef": null
  }
}
