{
  "schemaVersion": 1,
  "trackId": "emerald-glade",
  "title": "Emerald Glade",
  "status": "legacy-active",
  "audioMode": "loop",
  "webAudioPath": "./assets/audio/emerald_glade.mp3",
  "audioHash": "ef55b92869abace270a8171e7f7f9bb3d9d799b6fcda1ade1c4ec86786f6c1eb",
  "loopDuration": 30,
  "rhythm": {
    "tempoHint": null,
    "bpmOverride": null,
    "beatOffsetOverride": null
  },
  "suggestedSections": [],
  "provenance": {
    "sourceType": "legacy-unknown",
    "provider": null,
    "commercialUseStatus": "review-required",
    "privateEvidenceRef": null
  }
}
