{
  "schemaVersion": 1,
  "trackId": "untitled-61be6b1153",
  "title": "Suno 61BE6B",
  "status": "active",
  "audioMode": "single",
  "webAudioPath": "./assets/audio/economicas/untitled-61be6b1153.mp3",
  "audioHash": "61be6b115310575224bb199e6683c7a55e624775be6a4ff8b2d9236f178d3bd0",
  "rhythm": {
    "tempoHint": 123.046875,
    "bpmOverride": null,
    "beatOffsetOverride": null
  },
  "suggestedSections": [
    {
      "id": "read",
      "name": "LECTURA",
      "startTime": 0,
      "endTime": 21.124505
    },
    {
      "id": "drive",
      "name": "IMPULSO",
      "startTime": 21.124505,
      "endTime": 42.24901
    },
    {
      "id": "climax",
      "name": "CLIMAX",
      "startTime": 42.24901,
      "endTime": 63.373515
    }
  ],
  "provenance": {
    "sourceType": "ai-generated",
    "provider": "suno",
    "commercialUseStatus": "evidence-required",
    "privateEvidenceRef": null
  },
  "durationSeconds": 63.373515
}
