{
  "schemaVersion": 1,
  "trackId": "neon-signal-11615b8092",
  "title": "Neon Signal",
  "status": "active",
  "audioMode": "single",
  "webAudioPath": "./assets/audio/neon-signal-11615b8092.mp3",
  "audioHash": "11615b80928c7f37d40b1cc1d1436e4ce6d5db18282a8f6573c9d2ff3c05b67a",
  "rhythm": {
    "tempoHint": 103.359375,
    "bpmOverride": null,
    "beatOffsetOverride": null
  },
  "suggestedSections": [
    {
      "id": "read",
      "name": "LECTURA",
      "startTime": 0,
      "endTime": 13.244505
    },
    {
      "id": "drive",
      "name": "IMPULSO",
      "startTime": 13.244505,
      "endTime": 26.48901
    },
    {
      "id": "climax",
      "name": "CLIMAX",
      "startTime": 26.48901,
      "endTime": 39.733515
    }
  ],
  "provenance": {
    "sourceType": "ai-generated",
    "provider": "suno",
    "commercialUseStatus": "evidence-required",
    "privateEvidenceRef": null
  },
  "durationSeconds": 39.733515
}
