{
  "schemaVersion": 1,
  "trackId": "radiant-tide-c667694c50",
  "title": "Radiant Tide C667694C50",
  "status": "active",
  "audioMode": "single",
  "webAudioPath": "./assets/audio/radiant-tide-c667694c50.mp3",
  "audioHash": "c667694c5052e5bd6ce9677340295e4ddb063dc80d75c84c8e6eeb28133476b6",
  "rhythm": {
    "tempoHint": 103.359375,
    "bpmOverride": null,
    "beatOffsetOverride": null
  },
  "suggestedSections": [
    {
      "id": "read",
      "name": "LECTURA",
      "startTime": 0,
      "endTime": 56.004505
    },
    {
      "id": "drive",
      "name": "IMPULSO",
      "startTime": 56.004505,
      "endTime": 112.00901
    },
    {
      "id": "climax",
      "name": "CLIMAX",
      "startTime": 112.00901,
      "endTime": 168.013515
    }
  ],
  "provenance": {
    "sourceType": "ai-generated",
    "provider": "suno",
    "commercialUseStatus": "evidence-required",
    "privateEvidenceRef": null
  },
  "durationSeconds": 168.013515
}
