{
  "schemaVersion": 1,
  "trackId": "hidden-rush-9570e22f98",
  "title": "Hidden Rush 9570E22F98",
  "status": "active",
  "audioMode": "single",
  "webAudioPath": "./assets/audio/premium/hidden-rush-9570e22f98.mp3",
  "audioHash": "9570e22f9858216bc05ac9775715eb5896e64d6eda5ad4dbb7495c7ba5b285a0",
  "rhythm": {
    "tempoHint": 135.999178,
    "bpmOverride": null,
    "beatOffsetOverride": null
  },
  "suggestedSections": [
    {
      "id": "read",
      "name": "LECTURA",
      "startTime": 0,
      "endTime": 23.137838
    },
    {
      "id": "drive",
      "name": "IMPULSO",
      "startTime": 23.137838,
      "endTime": 46.275677
    },
    {
      "id": "climax",
      "name": "CLIMAX",
      "startTime": 46.275677,
      "endTime": 69.413515
    }
  ],
  "provenance": {
    "sourceType": "ai-generated",
    "provider": "suno",
    "commercialUseStatus": "evidence-required",
    "privateEvidenceRef": null
  },
  "durationSeconds": 69.413515
}
