{
  "schemaVersion": 1,
  "trackId": "paperback-afternoon",
  "title": "Paperback Afternoon",
  "status": "legacy-active",
  "audioMode": "loop",
  "webAudioPath": "./assets/audio/paperback_afternoon.mp3",
  "audioHash": "52aaa82e1909380124fb28f63d580037d17f39dbca57f75165e01a25fd746cec",
  "loopDuration": 30,
  "rhythm": {
    "tempoHint": null,
    "bpmOverride": null,
    "beatOffsetOverride": null
  },
  "suggestedSections": [],
  "provenance": {
    "sourceType": "legacy-unknown",
    "provider": null,
    "commercialUseStatus": "review-required",
    "privateEvidenceRef": null
  }
}
